{
  "request_id": "cd632bfe-2471-58b2-adc8-7ad4ce77d637",
  "task_id": "1ab2258a-ce60-528f-8044-4988641fcbaf",
  "run_version": 1,
  "capability": "risk.fusion",
  "model_name": "synthetic_M08",
  "model_version": "0.1.0-fixture",
  "preprocessing_version": "synthetic-v1",
  "mapping_version": "synthetic-v1",
  "status": "SUCCEEDED",
  "output_kind": "classification",
  "findings": [
    {
      "finding_id": "a5b9eedf-d276-5aa3-b8ba-1ab2e6c6f93f",
      "kind": "classification",
      "label": "synthetic-v1",
      "raw_score": 0.5,
      "calibrated_score": 0.5,
      "threshold_version": "synthetic-v1",
      "model_name": "synthetic-v1",
      "model_version": "synthetic-v1",
      "time_range": {
        "start_ms": 0,
        "end_ms": 1000
      },
      "bbox": {
        "x": 0.1,
        "y": 0.1,
        "width": 0.4,
        "height": 0.4
      },
      "mask_ref": {
        "object_id": "dc276b30-cc36-5e47-ab56-38b6b39b58e3",
        "version_id": "synthetic-v1",
        "sha256": "0000000000000000000000000000000000000000000000000000000000000000"
      },
      "evidence_ids": [
        "7933dd06-fd2a-5a46-a7e2-40c43ffec20e"
      ],
      "status": "candidate",
      "mapping_version": "synthetic-v1",
      "track_id": "synthetic-v1",
      "frame_id": "edfbf475-2ab9-5c5c-91b2-e6f5ee402b0a"
    }
  ],
  "artifacts": [
    {
      "object_id": "20ba5420-82d1-572f-95f0-22a028680076",
      "version_id": "synthetic-v1",
      "sha256": "0000000000000000000000000000000000000000000000000000000000000000"
    }
  ],
  "missing_modalities": [],
  "warnings": [],
  "reason": "synthetic-v1",
  "latency_ms": 0.5,
  "mock": true,
  "payload": {
    "labels": [
      {
        "label": "synthetic-v1",
        "raw_score": 0.5,
        "calibrated_score": 0.5,
        "threshold_version": "synthetic-v1"
      }
    ]
  }
}
